Title,SellerSKU,ASIN,,In Stock Level,List Price,CPU,In Stock Value,Supplier,Date Purchased,Notes,,,,
"""Total Defense 5"" Right Guard Brand Deodorant for Men (1 Stick of Cool Peak Deodorant)",BL01122017/1.92,B00166GUYW,"B00166GUYW,",2,49.99,1.92,3.84,Big Lots,1/12/17,,,,,"('B00166GUYW', '""Total Defense 5"" Right Guard Brand Deodorant for Men (1 Stick of Cool Peak Deodorant)', 2, 49.99),"
(2 Pack) Nature Valley Breakfast Biscuits Lemon Poppy Seed 5- 1.770z Pouches,BL02082017/4.86,B00TWMIUJK,"B00TWMIUJK,",1,17.25,4.86,4.86,Big Lots,2/8/17,,"'B00TWMIUJK',",,,"('B00TWMIUJK', '(2 Pack) Nature Valley Breakfast Biscuits Lemon Poppy Seed 5- 1.770z Pouches', 1, 17.25),"
"(3 Pack) L'Oreal Paris Advanced Hairstyle Txt It Toussle Wave Spray, 6.8 Fl Oz.",BL03032017/4.62,B010OPU26C,"B010OPU26C,",1,17.95,4.62,4.62,Big Lots,3/3/17,,"'B010OPU26C',",,,"('B010OPU26C', '(3 Pack) L'Oreal Paris Advanced Hairstyle Txt It Toussle Wave Spray, 6.8 Fl Oz.', 1, 17.95),"
"(Pack 3) CoverGirl 250 Lipslicks Smoochies Lip Balm, 2 Cute, 0.14 Ounce",BL03032017//2.32,B00XUPKM2S,"B00XUPKM2S,",2,34.99,2.32,4.64,Big Lots,3/3/17,,"'B00XUPKM2S',",,,"('B00XUPKM2S', '(Pack 3) CoverGirl 250 Lipslicks Smoochies Lip Balm, 2 Cute, 0.14 Ounce', 2, 34.99),"
2 Crest Pro Health For Life Toothpaste Smooth Mint 6oz Tubes Designed Adult 50+,BLl02272017/3.85,B01LDYLZ50,"B01LDYLZ50,",1,22.96,3.85,3.85,Big Lots,2/27/17,,"'B01LDYLZ50',",,,"('B01LDYLZ50', '2 Crest Pro Health For Life Toothpaste Smooth Mint 6oz Tubes Designed Adult 50+', 1, 22.96),"
2 Pack- Revlon Colorburst Lip Butter Lipstick #080 Strawberry Shortcake,BL02272017//3.23,B01I8CD9V8,"B01I8CD9V8,",4,14.95,3.23,12.92,Big Lots,2/27/17,,"'B01I8CD9V8',",,,"('B01I8CD9V8', '2 Pack- Revlon Colorburst Lip Butter Lipstick #080 Strawberry Shortcake', 4, 14.95),"
"Absorbine Jr. Cream, 2 Ounce (Pack of 4)",NPS01132017/10.21,B00TOCKZ5A,"B00TOCKZ5A,",2,29.99,10.21,20.42,NPS,1/13/17,,"'B00TOCKZ5A',",,,"('B00TOCKZ5A', 'Absorbine Jr. Cream, 2 Ounce (Pack of 4)', 2, 29.99),"
Accounting For Managers: Interpreting Accounting Information for Decision-Making,FBA07132016/6.65,1119979676,"1119979676,",1,23,6.65,6.65,Amazon,7/13/16,,"'1119979676',",,,"('1119979676', 'Accounting For Managers: Interpreting Accounting Information for Decision-Making', 1, 23),"
"Aerosoles Women's Air Cushion Fashion Sneaker,Black Fabric,7 W US",FBA05232016__69,B00XD2WWD0,"B00XD2WWD0,",1,51.7,16.54,16.54,Amazon,5/19/16,,"'B00XD2WWD0',",,,"('B00XD2WWD0', 'Aerosoles Women's Air Cushion Fashion Sneaker,Black Fabric,7 W US', 1, 51.7),"
"AK Anne Klein Sport Women's Camrynne Wedge, Pink Multi/Black, 6 M US",FBA07032106/17.25,B016EO2COM,"B016EO2COM,",1,32.69,17.25,17.25,Amazon,7/3/16,,"'B016EO2COM',",,,"('B016EO2COM', 'AK Anne Klein Sport Women's Camrynne Wedge, Pink Multi/Black, 6 M US', 1, 32.69),"
Alberto V05 Tea Therapy Smoothing Conditioner,BL03292017/1.02,B00H3R6G7E,"B00H3R6G7E,",2,14.95,1.02,2.04,Big Lots,3/29/17,,"'B00H3R6G7E',",,,"('B00H3R6G7E', 'Alberto V05 Tea Therapy Smoothing Conditioner', 2, 14.95),"
"Almay Smart Shade Concealer, Medium, 0.37-Ounce Tubes (Pack of 2)",BL11282016/5.39,B0039UTUJK,"B0039UTUJK,",2,19.99,5.39,10.78,Big Lots,11/28/16,,"'B0039UTUJK',",,,"('B0039UTUJK', 'Almay Smart Shade Concealer, Medium, 0.37-Ounce Tubes (Pack of 2)', 2, 19.99),"
American Girl Crafts Super Scrapbook Kit,TM04062017/10.25,B004IWL77G,"B004IWL77G,",2,40.99,10.25,20.5,Tuesday Morning,4/6/17,,"'B004IWL77G',",,,"('B004IWL77G', 'American Girl Crafts Super Scrapbook Kit', 2, 40.99),"
Atrac-Tain Moisturizing Cream,NPS03302107/3.19,B003TXVZRM,"B003TXVZRM,",8,14.99,3.19,25.52,NPS,3/30/17,,"'B003TXVZRM',",,,"('B003TXVZRM', 'Atrac-Tain Moisturizing Cream', 8, 14.99),"
Automatic Card Shuffler 1 or 2 Decks,TM02162017/5.98,B000LG25EW,"B000LG25EW,",1,19.99,5.98,5.98,Tuesday Morning,2/16/17,,"'B000LG25EW',",,,"('B000LG25EW', 'Automatic Card Shuffler 1 or 2 Decks', 1, 19.99),"
"Barbie - Bathing Suit Ken Doll, Includes Doll and Swimsuit",RA02092017//8.74,B0045VLMFW,"B0045VLMFW,",2,23.99,8.74,17.48,Rite Aid,2/9/17,,"'B0045VLMFW',",,,"('B0045VLMFW', 'Barbie - Bathing Suit Ken Doll, Includes Doll and Swimsuit', 2, 23.99),"
Barbie and Friends Fashionistas Multipack Doll,TM04072017/20.51,B00TXI272E,"B00TXI272E,",2,69.99,20.51,41.02,Tuesday Morning,4/7/17,,"'B00TXI272E',",,,"('B00TXI272E', 'Barbie and Friends Fashionistas Multipack Doll', 2, 69.99),"
Barbie Fairytale Mermaid Summer Doll,RA03312017/13.53,B00M5ATTPA,"B00M5ATTPA,",1,32.92,13.53,13.53,NPS,3/31/17,,"'B00M5ATTPA',",,,"('B00M5ATTPA', 'Barbie Fairytale Mermaid Summer Doll', 1, 32.92),"
"Barbie Flatware Set with Spoon and Fork, Pink",WG04062017/.78,B00CNVOQT0,"B00CNVOQT0,",1,9.95,0.78,0.78,Walgreens,4/6/17,,"'B00CNVOQT0',",,,"('B00CNVOQT0', 'Barbie Flatware Set with Spoon and Fork, Pink', 1, 9.95),"
Bc Headache Powdr 24ct Size 24ct Bc Headache Powdr 24ct,FBA08092016/6.35,B00FQR93KA,"B00FQR93KA,",4,24.99,6.35,25.4,NPS,8/9/16,,"'B00FQR93KA',",,,"('B00FQR93KA', 'Bc Headache Powdr 24ct Size 24ct Bc Headache Powdr 24ct', 4, 24.99),"
Bedskirt by Belles & Whistles (ivory/cream),TM03092017//5.12,B0184RU050,"B0184RU050,",1,22.99,5.12,5.12,Tuesday Morning,3/9/17,,"'B0184RU050',",,,"('B0184RU050', 'Bedskirt by Belles & Whistles (ivory/cream)', 1, 22.99),"
Biore Deep Cleansing Pore Strips Nose 8 Each (Pack of 8),NPS03302017/4.26,B004WKGLCA,"B004WKGLCA,",7,16.99,4.26,29.82,NPS,3/30/17,,"'B004WKGLCA',",,,"('B004WKGLCA', 'Biore Deep Cleansing Pore Strips Nose 8 Each (Pack of 8)', 7, 16.99),"
BOOTS No7 Lift & Luminate Day Cream SPF15 1.6 Fl. Oz/ 50 ml,WG04062017/11.61,B0092TVLVW,"B0092TVLVW,",2,28.99,11.61,23.22,Walgreens,4/6/17,,"'B0092TVLVW',",,,"('B0092TVLVW', 'BOOTS No7 Lift & Luminate Day Cream SPF15 1.6 Fl. Oz/ 50 ml', 2, 28.99),"
Boots No7 Lift & Luminate Foundation Cool Honey,WG01262017//6.4,B00JZQUGTU,"B00JZQUGTU,",1,18.2,6.4,6.4,Walgreens,1/26/17,,"'B00JZQUGTU',",,,"('B00JZQUGTU', 'Boots No7 Lift & Luminate Foundation Cool Honey', 1, 18.2),"
"Boston Warehouse Coffee Labels Espresso Cups (Set of 4), 4 oz",TM04062017/4.08,B0199SWXVM,"B0199SWXVM,",4,29.99,4.09,16.36,Tuesday Morning,4/6/17,,"'B0199SWXVM',",,,"('B0199SWXVM', 'Boston Warehouse Coffee Labels Espresso Cups (Set of 4), 4 oz', 4, 29.99),"
Calphalon Classic Bakeware 14-by-17-Inch Rectangular Nonstick Large Cookie Sheet,TM02162017--8.54,B0009EYIU0,"B0009EYIU0,",2,21.29,8.54,17.08,Tuesday Morning,2/16/17,,"'B0009EYIU0',",,,"('B0009EYIU0', 'Calphalon Classic Bakeware 14-by-17-Inch Rectangular Nonstick Large Cookie Sheet', 2, 21.29),"
Campbell Essential Biology with MasteringBiology (4th Edition),TXT09032016/1,321602064,"321602064,",2,13.99,1,2,Yard Sale,9/3/16,,"'321602064',",,,"('321602064', 'Campbell Essential Biology with MasteringBiology (4th Edition)', 2, 13.99),"
Cellas Delicious Cherry Covered with Real Milk Chocolate 22 Foil Wrapped Cherries 11 Oz,RA01122017/3.71,B00TEFLP74,"B00TEFLP74,",5,11.99,3.71,18.55,Rite Aid,1/12/17,,"'B00TEFLP74',",,,"('B00TEFLP74', 'Cellas Delicious Cherry Covered with Real Milk Chocolate 22 Foil Wrapped Cherries 11 Oz', 5, 11.99),"
Chapstick Total Hydration Vanilla & Honey - 2 Count,WG03142017/2.83,B01MY4BNFQ,"B01MY4BNFQ,",1,14.99,2.83,2.83,Walgreens,3/14/17,,"'B01MY4BNFQ',",,,"('B01MY4BNFQ', 'Chapstick Total Hydration Vanilla & Honey - 2 Count', 1, 14.99),"
CHEFS Ceramic Coated Jelly Roll Pan,TM03312017/10.83,B00E93G49A,"B00E93G49A,",2,59.99,10.83,21.66,Tuesday Morning,3/31/17,,"'B00E93G49A',",,,"('B00E93G49A', 'CHEFS Ceramic Coated Jelly Roll Pan', 2, 59.99),"
"Chefs Nonstick French Fry Baking Sheet 15 Inch, Gray",TM02102017/7.09,B00C6H6YTG,"B00C6H6YTG,",2,26.9,7.09,14.18,Tuesday Morning,2/10/17,,"'B00C6H6YTG',",,,"('B00C6H6YTG', 'Chefs Nonstick French Fry Baking Sheet 15 Inch, Gray', 2, 26.9),"
"CHEFS Nonstick French Fry Baking Sheet: 18""",TM02182017/6.15,B00PBEAAY6,"B00PBEAAY6,",2,22.17,6.15,12.3,Tuesday Morning,2/18/17,,"'B00PBEAAY6',",,,"('B00PBEAAY6', 'CHEFS Nonstick French Fry Baking Sheet: 18""', 2, 22.17),"
CHEFS Stainless Steel Electric Skillet - 12,TM01162017/63.58,B016K4AMY8,"B016K4AMY8,",2,159,63.58,127.16,Tuesday Morning,1/16/17,,"'B016K4AMY8',",,,"('B016K4AMY8', 'CHEFS Stainless Steel Electric Skillet - 12', 2, 159),"
CIA Masters Collection Nonstick 13 Inch x 18 Inch Large Jelly Roll Pan,TM03092017//12.81,B000HV6X5S,"B000HV6X5S,",1,49.99,12.81,12.81,Tuesday Morning,3/9/17,,"'B000HV6X5S',",,,"('B000HV6X5S', 'CIA Masters Collection Nonstick 13 Inch x 18 Inch Large Jelly Roll Pan', 1, 49.99),"
CIA Masters Collection Nonstick 14 Inch x 17 Inch Large Baking Sheet,TM03092017--12.81,B000HV6X58,"B000HV6X58,",1,49.99,12.81,12.81,Tuesday Morning,3/9/17,,"'B000HV6X58',",,,"('B000HV6X58', 'CIA Masters Collection Nonstick 14 Inch x 17 Inch Large Baking Sheet', 1, 49.99),"
"Clocky Alarm Clock On Wheels, Chrome",NPS03302017/24.56,B001989WIS,"B001989WIS,",2,59.15,24.56,49.12,NPS,3/30/17,,"'B001989WIS',",,,"('B001989WIS', 'Clocky Alarm Clock On Wheels, Chrome', 2, 59.15),"
Colgate Kids Anticavity Fluoride Rinse / Mouthwash - Bubble Gum Swirl - Alcohol-Free - Net Wt. 16.9 FL OZ (500 mL) Each - Pack of 2,BL04012017/5.13,B0177F38HW,"B0177F38HW,",1,24.95,5.13,5.13,Big Lots,4/1/17,,"'B0177F38HW',",,,"('B0177F38HW', 'Colgate Kids Anticavity Fluoride Rinse / Mouthwash - Bubble Gum Swirl - Alcohol-Free - Net Wt. 16.9 FL OZ (500 mL) Each - Pack of 2', 1, 24.95),"
"CoverGirl 225 Lipslicks Smoochies Lip Balm, Tweet Me, 0.14 Ounce",WG02272017/.6,B00C67ED3U,"B00C67ED3U,",1,15.99,0.6,0.6,Walgreens,2/27/17,,"'B00C67ED3U',",,,"('B00C67ED3U', 'CoverGirl 225 Lipslicks Smoochies Lip Balm, Tweet Me, 0.14 Ounce', 1, 15.99),"
"CoverGirl 250 Lipslicks Smoochies Lip Balm, 2 Cute, 0.14 Ounce",BL03032017/.77,B00C67ED3A,"B00C67ED3A,",1,15.99,0.77,0.77,Big Lots,3/3/17,,"'B00C67ED3A',",,,"('B00C67ED3A', 'CoverGirl 250 Lipslicks Smoochies Lip Balm, 2 Cute, 0.14 Ounce', 1, 15.99),"
"CoverGirl 330 Flamed Out Shadow Pencil, Gold Flame, 0.08 Ounce",BL03142017/.78,B00C64HR2W,"B00C64HR2W,",3,8.99,0.78,2.34,Big Lots,3/14/17,,"'B00C64HR2W',",,,"('B00C64HR2W', 'CoverGirl 330 Flamed Out Shadow Pencil, Gold Flame, 0.08 Ounce', 3, 8.99),"
COVERGIRL Blastflipstick Lipcolor Glimmer 0.134 Oz,BL03032017--.77,B005SD1YVS,"B005SD1YVS,",1,10.25,0.77,0.77,Big Lots,3/3/17,,"'B005SD1YVS',",,,"('B005SD1YVS', 'COVERGIRL Blastflipstick Lipcolor Glimmer 0.134 Oz', 1, 10.25),"
COVERGIRL Blastflipstick Lipcolor Stunner 0.134 Oz,BL03032017//.77,B005SD1Z80,"B005SD1Z80,",1,13.99,0.77,0.77,Big Lots,3/3/17,,"'B005SD1Z80',",,,"('B005SD1Z80', 'COVERGIRL Blastflipstick Lipcolor Stunner 0.134 Oz', 1, 13.99),"
"CoverGirl Clean Pressed Powder, Sensitive Skin, Fragrance-Free, Tawny 265",BL03032017/2.69,B003FBMHR0,"B003FBMHR0,",3,12.99,2.69,8.07,Big Lots,3/3/17,,"'B003FBMHR0',",,,"('B003FBMHR0', 'CoverGirl Clean Pressed Powder, Sensitive Skin, Fragrance-Free, Tawny 265', 3, 12.99),"
"CoverGirl Clean Sensitive Skin Pressed Powder Soft Honey (W) 255, 0.35 Ounce Pan",BL03032017/2.31,B00C67802U,"B00C67802U,",4,18.99,2.31,9.24,Big Lots,3/3/17,,"'B00C67802U',",,,"('B00C67802U', 'CoverGirl Clean Sensitive Skin Pressed Powder Soft Honey (W) 255, 0.35 Ounce Pan', 4, 18.99),"
"COVERGIRL Queen Vivid Impact Eyeliner Cabernet Q315, .033 oz",BL03032017/2.15,B0062GZEPW,"B0062GZEPW,",2,10.99,2.15,4.3,Big Lots,3/3/17,,"'B0062GZEPW',",,,"('B0062GZEPW', 'COVERGIRL Queen Vivid Impact Eyeliner Cabernet Q315, .033 oz', 2, 10.99),"
Cra Z Art Peanuts Snoopy Paint by Number Large Set,TM03092017/2.04,B011BW02MG,"B011BW02MG,",1,12.49,2.04,2.04,Tuesday Morning,3/9/17,,"'B011BW02MG',",,,"('B011BW02MG', 'Cra Z Art Peanuts Snoopy Paint by Number Large Set', 1, 12.49),"
Creativity for Kids Feather Jewelry Kit,TM04062017/5.98,B009KORU7I,"B009KORU7I,",4,18.78,5.98,23.92,Tuesday Morning,4/6/17,,"'B009KORU7I',",,,"('B009KORU7I', 'Creativity for Kids Feather Jewelry Kit', 4, 18.78),"
Crest Complete Extra White Plus Scope Dual-Blast Fresh Breath Toothpaste - Fresh Mint Blast 7.6 Oz (Pack of 2),BL04012017//5.13,B005HNX2RS,"B005HNX2RS,",3,19.95,5.13,15.39,Big Lots,4/1/17,,"'B005HNX2RS',",,,"('B005HNX2RS', 'Crest Complete Extra White Plus Scope Dual-Blast Fresh Breath Toothpaste - Fresh Mint Blast 7.6 Oz (Pack of 2)', 3, 19.95),"
"Crest Pro-Health Advanced Fluoride Toothpaste for Anticavity, Antigingivitis and Sensitive Teeth, Mint - 5.8 Oz",BL02272017/2.73,B0052AR2MC,"B0052AR2MC,",3,12.66,2.73,8.19,Big Lots,2/27/17,,"'B0052AR2MC',",,,"('B0052AR2MC', 'Crest Pro-Health Advanced Fluoride Toothpaste for Anticavity, Antigingivitis and Sensitive Teeth, Mint - 5.8 Oz', 3, 12.66),"
"Crest Pro-Health Advanced Smooth Mint Toothpaste 4 oz, Twin Pack,  (Packaging may vary)",BL03292017/4.27,B005PLQGUC,"B005PLQGUC,",2,24.99,4.27,8.54,Big Lots,3/29/17,,"'B005PLQGUC',",,,"('B005PLQGUC', 'Crest Pro-Health Advanced Smooth Mint Toothpaste 4 oz, Twin Pack,  (Packaging may vary)', 2, 24.99),"
Crest Pro-health Advanced Toothpaste Smooth Mint 4.0 Oz,BL03032017/1.92,B0040BC77Y,"B0040BC77Y,",1,9.5,1.92,1.92,Big Lots,3/3/17,,"'B0040BC77Y',",,,"('B0040BC77Y', 'Crest Pro-health Advanced Toothpaste Smooth Mint 4.0 Oz', 1, 9.5),"
Crest Pro-Health Toothpaste - Clinical Gum Protection - Invigorating Clean Mint 4.0 Oz (Pack of 3),BL02152017/5.83,B00CBYN7SU,"B00CBYN7SU,",3,21.99,5.83,17.49,Big Lots,2/15/17,,"'B00CBYN7SU',",,,"('B00CBYN7SU', 'Crest Pro-Health Toothpaste - Clinical Gum Protection - Invigorating Clean Mint 4.0 Oz (Pack of 3)', 3, 21.99),"
Crest Pro-Health Toothpaste - Clinical Gum Protection - Invigorating Clean Mint 4.0 Oz (Pack of 3),BL02032017/4.85,B00CBYN7SU,"B00CBYN7SU,",5,21.99,4.84,24.2,Big Lots,2/3/17,,"'B00CBYN7SU',",,,"('B00CBYN7SU', 'Crest Pro-Health Toothpaste - Clinical Gum Protection - Invigorating Clean Mint 4.0 Oz (Pack of 3)', 5, 21.99),"
"Crest Sensi-Care With Fluoride-Alcohol Free Mild Mint Rinse 500 ml, Pack of 2.",FBA08092016/4.42,B00NH77QM8,"B00NH77QM8,",2,29.99,4.42,8.84,Big Lots,8/9/16,,"'B00NH77QM8',",,,"('B00NH77QM8', 'Crest Sensi-Care With Fluoride-Alcohol Free Mild Mint Rinse 500 ml, Pack of 2.', 2, 29.99),"
"Crest Whitening Expressions Toothpaste, Extreme Herbal mint - 6 oz",BL01212017//2.14,B0014CQD8Q,"B0014CQD8Q,",1,15.99,2.14,2.14,Big Lots,1/21/17,,"'B0014CQD8Q',",,,"('B0014CQD8Q', 'Crest Whitening Expressions Toothpaste, Extreme Herbal mint - 6 oz', 1, 15.99),"
Crest Whitening Plus Scope Toothpaste Citrus Splash - 6.2 Oz,BL01212017/2.14,B0016JFCPC,"B0016JFCPC,",1,19.99,2.14,2.14,Big Lots,1/21/17,,"'B0016JFCPC',",,,"('B0016JFCPC', 'Crest Whitening Plus Scope Toothpaste Citrus Splash - 6.2 Oz', 1, 19.99),"
"Crest, 3D White Luxe Sensitivity Whitening Pampering Mint Flavor Toothpaste - 4.1 Oz, Pack of 2",BL04012017/4.12,B00IKFI162,"B00IKFI162,",3,20.99,4.12,12.36,Big Lots,4/1/17,,"'B00IKFI162',",,,"('B00IKFI162', 'Crest, 3D White Luxe Sensitivity Whitening Pampering Mint Flavor Toothpaste - 4.1 Oz, Pack of 2', 3, 20.99),"
"Cricut Imagine Cartridge, Kate's Kitchen",FBAYS08272016.2,B0044WVUXQ,"B0044WVUXQ,",1,15.99,2,2,Yard Sale,8/27/16,,"'B0044WVUXQ',",,,"('B0044WVUXQ', 'Cricut Imagine Cartridge, Kate's Kitchen', 1, 15.99),"
"Curate Snack Bars, Indulgent Dark Chocolate & Hazelnuts, 4 Bars",BL01132017/2.4,B01DSF6R5A,"B01DSF6R5A,",3,12.99,2.4,7.2,Big Lots,1/13/17,,"'B01DSF6R5A',",,,"('B01DSF6R5A', 'Curate Snack Bars, Indulgent Dark Chocolate & Hazelnuts, 4 Bars', 3, 12.99),"
"Curel Ultra Healing Hand Therapy, 3.5 Oz",BL04062017/1.96,B000QUM7RI,"B000QUM7RI,",4,25,1.96,7.84,Big Lots,4/6/17,,"'B000QUM7RI',",,,"('B000QUM7RI', 'Curel Ultra Healing Hand Therapy, 3.5 Oz', 4, 25),"
"Curel Ultra Healing Hand Therapy, 3.5 Oz (Pack of 2)",BL04062017/3.91,B0016G18L2,"B0016G18L2,",1,44.99,3.91,3.91,Big Lots,4/6/17,,"'B0016G18L2',",,,"('B0016G18L2', 'Curel Ultra Healing Hand Therapy, 3.5 Oz (Pack of 2)', 1, 44.99),"
Dansk Classic Fjord Grey Oval Baker Small,TM11232016/3.62,B004IFTXD8,"B004IFTXD8,",1,20,3.62,3.62,Tuesday Morning,11/23/16,,"'B004IFTXD8',",,,"('B004IFTXD8', 'Dansk Classic Fjord Grey Oval Baker Small', 1, 20),"
"DCI Pop Quiz Math Measuring Cups and Spoons Set, Black",TM01052017/2.72,B00JGLE1I6,"B00JGLE1I6,",3,11.99,2.72,8.16,Tuesday Morning,1/5/17,,"'B00JGLE1I6',",,,"('B00JGLE1I6', 'DCI Pop Quiz Math Measuring Cups and Spoons Set, Black', 3, 11.99),"
Developlus Make It Straight Salon Blowout Results 6oz & 1oz,RA01262017/3.4,B00LAXX4VI,"B00LAXX4VI,",3,19.99,3.4,10.2,Rite Aid,1/26/17,,"'B00LAXX4VI',",,,"('B00LAXX4VI', 'Developlus Make It Straight Salon Blowout Results 6oz & 1oz', 3, 19.99),"
"Dial Nutriskin Body Wash, Grapeseed Oil and Lemongrass, 16-Ounce (Pack of 2)",NPS02162017/6.39,B004HKBLKC,"B004HKBLKC,",4,24.99,6.39,25.56,NPS,2/16/17,,"'B004HKBLKC',",,,"('B004HKBLKC', 'Dial Nutriskin Body Wash, Grapeseed Oil and Lemongrass, 16-Ounce (Pack of 2)', 4, 24.99),"
"Dimensions Needlecrafts Handmade Embroidery, Bird On Flower Pillow",FBA06242016/3.19,B004ZKCYZK,"B004ZKCYZK,",1,16.95,3.19,3.19,Seagull Book,6/24/16,,"'B004ZKCYZK',",,,"('B004ZKCYZK', 'Dimensions Needlecrafts Handmade Embroidery, Bird On Flower Pillow', 1, 16.95),"
Disney Junior Minnie Music Mat,WG01192017/7.05,B01M0A2SNM,"B01M0A2SNM,",1,33.99,7.05,7.05,Walgreens,1/19/17,,"'B01M0A2SNM',",,,"('B01M0A2SNM', 'Disney Junior Minnie Music Mat', 1, 33.99),"
"Disney Mickey Mouse Clubhouse ""Sing with Me"" CD Player",WG02102017/13.93,B002RLE2TK,"B002RLE2TK,",2,32.2,13.93,27.86,Walgreen,2/10/17,,"'B002RLE2TK',",,,"('B002RLE2TK', 'Disney Mickey Mouse Clubhouse ""Sing with Me"" CD Player', 2, 32.2),"
"Disney Princess 4 in 1 Card Game Set ""Crazy Eights"", ""Old Maid"", ""Go Fish"" and ""Memory Match"" in Tin Box",TM03222017/4.21,B002DZFEXI,"B002DZFEXI,",1,23.78,4.21,4.21,Tuesday Morning,3/22/17,,"'B002DZFEXI',",,,"('B002DZFEXI', 'Disney Princess 4 in 1 Card Game Set ""Crazy Eights"", ""Old Maid"", ""Go Fish"" and ""Memory Match"" in Tin Box', 1, 23.78),"
Disney Princess Sparkling Princess Ariel Doll,WG03312017/9.02,B00B88X7MG,"B00B88X7MG,",2,29.95,9.02,18.04,Walgreens,3/31/17,,"'B00B88X7MG',",,,"('B00B88X7MG', 'Disney Princess Sparkling Princess Ariel Doll', 2, 29.95),"
Disney Princess Sparkling Princess Sleeping Beauty Doll,WG02092017/11.15,B00B86SVYW,"B00B86SVYW,",2,25.6,11.15,22.3,Walgreens,2/9/18,,"'B00B86SVYW',",,,"('B00B86SVYW', 'Disney Princess Sparkling Princess Sleeping Beauty Doll', 2, 25.6),"
Disney Sparkle Princess Tiana Doll,WG03102017/11.27,B00M5ATIWY,"B00M5ATIWY,",1,29.94,11.27,11.27,Walgreens,3/10/17,,"'B00M5ATIWY',",,,"('B00M5ATIWY', 'Disney Sparkle Princess Tiana Doll', 1, 29.94),"
Disneys Mickey Mouse Clubhouse Inflatable Swimming Pool,FBA04052016__3,B00WOWLIEE,"B00WOWLIEE,",2,21.88,10.67,21.34,Walgreen,4/4/16,,"'B00WOWLIEE',",,,"('B00WOWLIEE', 'Disneys Mickey Mouse Clubhouse Inflatable Swimming Pool', 2, 21.88),"
Dotz Home Entertainment Cord Identifier Kit for Cord and Cable Management (DCI131HEK-C),RA02162017//3.75,B0085U9GRK,"B0085U9GRK,",1,19.99,3.75,3.75,Rite Aid,2/16/17,,"'B0085U9GRK',",,,"('B0085U9GRK', 'Dotz Home Entertainment Cord Identifier Kit for Cord and Cable Management (DCI131HEK-C)', 1, 19.99),"
DreamWorks Trolls Branch Collectible Figure,WG02022017/5.7,B01BY1IXBQ,"B01BY1IXBQ,",1,23.99,5.7,5.7,Walgreens,2/2/17,,"'B01BY1IXBQ',",,,"('B01BY1IXBQ', 'DreamWorks Trolls Branch Collectible Figure', 1, 23.99),"
"Ecco Footwear Womens Belleair Sling Dress Pump, Teak, 41 EU/10-10.5 M US",FBA07022016/36.82,B010RSRIUE,"B010RSRIUE,",1,73.03,36.82,36.82,Amazon,7/2/16,,"'B010RSRIUE',",,,"('B010RSRIUE', 'Ecco Footwear Womens Belleair Sling Dress Pump, Teak, 41 EU/10-10.5 M US', 1, 73.03),"
Educational Insights GeoSafari Tuff Scope,TM03312017/12.49,B00486ZVXS,"B00486ZVXS,",1,36.99,12.49,12.49,Tuesday Morning,3/31/17,,"'B00486ZVXS',",,,"('B00486ZVXS', 'Educational Insights GeoSafari Tuff Scope', 1, 36.99),"
Elegant Baby - Space Party Bath Squirties,TM03172017--8.54,B00XO3NRZ0,"B00XO3NRZ0,",1,21.25,8.54,8.54,Tuesday Morning,3/17/17,,"'B00XO3NRZ0',",,,"('B00XO3NRZ0', 'Elegant Baby - Space Party Bath Squirties', 1, 21.25),"
"Elegant Baby 6 Piece Bath Time Fun Rubber Water Squirties Vinyl Zip Storage Bag, Fairy Party",TM03172017//8.54,B017P30356,"B017P30356,",3,2500.49,8.54,25.62,Tuesday Morning,3/17/17,,"'B017P30356',",,,"('B017P30356', 'Elegant Baby 6 Piece Bath Time Fun Rubber Water Squirties Vinyl Zip Storage Bag, Fairy Party', 3, 2500.49),"
"Enesco Gund Classic Beatrix Potter 3-Cup and Dish Set, Multi",TM03272017/14.16,B00SAQ2298,"B00SAQ2298,",1,42.99,14.16,14.16,Tuesday Morning,3/27/17,,"'B00SAQ2298',",,,"('B00SAQ2298', 'Enesco Gund Classic Beatrix Potter 3-Cup and Dish Set, Multi', 1, 42.99),"
Everything Mary EVM-9474-1 Quilted Sewing Machine Cover,TM02162017/4.27,B01IX3HFEY,"B01IX3HFEY,",3,29.99,4.27,12.81,Tuesday Morning,2/16/17,,"'B01IX3HFEY',",,,"('B01IX3HFEY', 'Everything Mary EVM-9474-1 Quilted Sewing Machine Cover', 3, 29.99),"
"Finesse Restore + Strengthen, Shampoo 13 oz (Pack of 3)",WG02072017/2.76,B00FQFB5N0,"B00FQFB5N0,",1,16.99,2.76,2.76,Walgreens,2/7/17,,"'B00FQFB5N0',",,,"('B00FQFB5N0', 'Finesse Restore + Strengthen, Shampoo 13 oz (Pack of 3)', 1, 16.99),"
"Fisher-Price Imaginext DC Super Friends, Batcopter",AZ02032017/15,B008YTQUS0,"B008YTQUS0,",1,40,15,15,Amazon,2/3/17,,"'B008YTQUS0',",,,"('B008YTQUS0', 'Fisher-Price Imaginext DC Super Friends, Batcopter', 1, 40),"
"Fisher-Price Imaginext DC Super Friends, Clayface",RA03312017/7.51,B006J4SPXK,"B006J4SPXK,",1,33.99,7.51,7.51,Rite Aid,3/31/17,,"'B006J4SPXK',",,,"('B006J4SPXK', 'Fisher-Price Imaginext DC Super Friends, Clayface', 1, 33.99),"
"Fleur by Fontignac Enameled Cast Iron Round Dutch Oven, 2.4-Quart, Blue",TM01062017/36.32,B00CYLDYRO,"B00CYLDYRO,",1,122.99,36.32,36.32,Tuesday Morning,1/6/17,,"'B00CYLDYRO',",,,"('B00CYLDYRO', 'Fleur by Fontignac Enameled Cast Iron Round Dutch Oven, 2.4-Quart, Blue', 1, 122.99),"
"Flexitol Heel Perfect, 2.5 Ounce",BL02152017/3.89,B008202G48,"B008202G48,",3,21.99,3.89,11.67,Big Lots,2/15/17,,"'B008202G48',",,,"('B008202G48', 'Flexitol Heel Perfect, 2.5 Ounce', 3, 21.99),"
"Florsheim Men's Hugo Boot,Brown,10 D",FBA07022016/62.9,B000PGXT84,"B000PGXT84,",1,170,62.9,62.9,Amazon,7/2/16,,"'B000PGXT84',",,,"('B000PGXT84', 'Florsheim Men's Hugo Boot,Brown,10 D', 1, 170),"
Fungi Nail 1oz Solution (Pack of 2),NPS03092017/12.8,B00E4MPRGM,"B00E4MPRGM,",4,24.98,12.8,51.2,NPS,3/9/17,,"'B00E4MPRGM',",,,"('B00E4MPRGM', 'Fungi Nail 1oz Solution (Pack of 2)', 4, 24.98),"
"GAK Art Dough, White",RA04072017/4.93,B00956A8VQ,"B00956A8VQ,",2,19.49,4.93,9.86,Rite Aid,4/7/17,,"'B00956A8VQ',",,,"('B00956A8VQ', 'GAK Art Dough, White', 2, 19.49),"
Gak Super Stretch Blastin' Blue and Think Pink,WG03312017--5.97,B01NBJTP15,"B01NBJTP15,",1,18.99,5.97,5.97,Walgreens,3/31/17,,"'B01NBJTP15',",,,"('B01NBJTP15', 'Gak Super Stretch Blastin' Blue and Think Pink', 1, 18.99),"
Gak Super Stretch Goo Green and Outrageous Orange,WG03312017/5.97,B01N8Y1UZ5,"B01N8Y1UZ5,",1,17.99,5.97,5.97,Walgreens,3/31/17,,"'B01N8Y1UZ5',",,,"('B01N8Y1UZ5', 'Gak Super Stretch Goo Green and Outrageous Orange', 1, 17.99),"
Gak Super Stretch Rockin' Red and Hello Yellow,WG03312017//5.97,B01N8U48W9,"B01N8U48W9,",1,19.97,5.97,5.97,Walgreens,3/31/17,,"'B01N8U48W9',",,,"('B01N8U48W9', 'Gak Super Stretch Rockin' Red and Hello Yellow', 1, 19.97),"
Girls' Shopkins Short Sleeve Tee - Black (Large),FBA07202016--6.92,B01I4OK8J6,"B01I4OK8J6,",1,14.99,6.92,6.92,Target,7/20/16,,"'B01I4OK8J6',",,,"('B01I4OK8J6', 'Girls' Shopkins Short Sleeve Tee - Black (Large)', 1, 14.99),"
Girls' The Secret Life of Pets Short Sleeve Tee - Green (Large),FBA07212016//-6.92,B01I5X588W,"B01I5X588W,",1,10.49,6.92,6.92,Target,7/21/16,,"'B01I5X588W',",,,"('B01I5X588W', 'Girls' The Secret Life of Pets Short Sleeve Tee - Green (Large)', 1, 10.49),"
Girls' The Secret Life of Pets Short Sleeve Tee - Green (X Small),FBA07212016---6.92,B01I4RUDYI,"B01I4RUDYI,",1,18.97,6.92,6.92,Target,7/21/16,,"'B01I4RUDYI',",,,"('B01I4RUDYI', 'Girls' The Secret Life of Pets Short Sleeve Tee - Green (X Small)', 1, 18.97),"
Global Security in the Twenty-first Century: The Quest for Power and the Search for Peace,FBA07132016/6.99,1442206144,"1442206144,",1,19,6.99,6.99,Amazon,7/13/16,,"'1442206144',",,,"('1442206144', 'Global Security in the Twenty-first Century: The Quest for Power and the Search for Peace', 1, 19),"
"Good Sense Roasted and Salted Pumpkin Seeds, Shelled, 6-Ounce Bags (Pack of 5)",FBA08032016/10.69,B00KPBGO4U,"B00KPBGO4U,",2,29.49,10.69,21.38,Big Lots,8/3/16,,"'B00KPBGO4U',",,,"('B00KPBGO4U', 'Good Sense Roasted and Salted Pumpkin Seeds, Shelled, 6-Ounce Bags (Pack of 5)', 2, 29.49),"
"Grande Kaffe Chocolate Peanut Butter Cup, 5.71 oz (18 Cups)",TJ03112017/2.79,B01AJBXHC2,"B01AJBXHC2,",1,20.99,2.79,2.79,TJ Maxx,3/11/17,,"'B01AJBXHC2',",,,"('B01AJBXHC2', 'Grande Kaffe Chocolate Peanut Butter Cup, 5.71 oz (18 Cups)', 1, 20.99),"
green sprouts Organic Blankie Cool Soothing Teether-Rose (Discontinued by Manufacturer),TM01052017/2.17,B002KFYJDW,"B002KFYJDW,",1,12.99,2.17,2.17,Tuesday Morning,1/5/17,,"'B002KFYJDW',",,,"('B002KFYJDW', 'green sprouts Organic Blankie Cool Soothing Teether-Rose (Discontinued by Manufacturer)', 1, 12.99),"
"GreenPan Healthy Ceramic Nonstick Sheet Pans BW000049-002 , Set of 2",TM03272017/16.66,B01JT755XG,"B01JT755XG,",2,59.99,16.66,33.32,Tuesday Morning,3/27/17,,"'B01JT755XG',",,,"('B01JT755XG', 'GreenPan Healthy Ceramic Nonstick Sheet Pans BW000049-002 , Set of 2', 2, 59.99),"
Gripeez - GE-MC12,WG03152017/.94,B00Q6TXHBI,"B00Q6TXHBI,",6,11.9,0.94,5.64,Walgreens,3/15/17,,"'B00Q6TXHBI',",,,"('B00Q6TXHBI', 'Gripeez - GE-MC12', 6, 11.9),"
Hallmark Greeting Card Display Organizer That Includes 12 Cards & Envelopes For very occasion,FBA06212016/4.26,B014RRTTQM,"B014RRTTQM,",5,24.95,4.26,21.3,Seagull Book,6/21/16,,"'B014RRTTQM',",,,"('B014RRTTQM', 'Hallmark Greeting Card Display Organizer That Includes 12 Cards & Envelopes For very occasion', 5, 24.95),"
Handy Heater Plug-In,WG01122017/21.15,B01LY3IC3Q,"B01LY3IC3Q,",2,28.48,21.15,42.3,Walgreens,1/12/17,,"'B01LY3IC3Q',",,,"('B01LY3IC3Q', 'Handy Heater Plug-In', 2, 28.48),"
