Title,SellerSKU,ASIN,,In Stock Level,List Price,CPU,In Stock Value,Supplier,Date Purchased,Notes,,,,
Pantene Pro-V Brunette Expressions Daily Color Enhancing Shampoo With Liquid Crystals 13 Oz (Pack of 3),BL03292017/8.01,B001F51V9S,"B001F51V9S,",4,49.56,8.01,32.04,Big Lots,3/29/17,,"'B001F51V9S',",,,"('B001F51V9S', 'Pantene Pro-V Brunette Expressions Daily Color Enhancing Shampoo With Liquid Crystals 13 Oz (Pack of 3)', 4, 49.56),"
"Pantene Pro-V Brunette Expressions Shampoo, Daily Color Enhancing, 13 oz.",BL03292017/2.67,B000GCWEGU,"B000GCWEGU,",3,17.68,2.67,8.01,Big Lots,3/29/17,,"'B000GCWEGU',",,,"('B000GCWEGU', 'Pantene Pro-V Brunette Expressions Shampoo, Daily Color Enhancing, 13 oz.', 3, 17.68),"
Pantene Pro-V Expert Collection Advanced Keratin Repair Conditioner 2.5 Fl Oz,BL03022017/1.15,B00AZYFH72,"B00AZYFH72,",3,8.95,1.15,3.45,Big Lots,3/2/17,,"'B00AZYFH72',",,,"('B00AZYFH72', 'Pantene Pro-V Expert Collection Advanced Keratin Repair Conditioner 2.5 Fl Oz', 3, 8.95),"
"Pantene Pro-V Expert Collection Dry Defy Intense Hydration Conditioner, 8.4 Ounce",BL01212017/1.28,B00OFXLF0W,"B00OFXLF0W,",2,13.95,1.28,2.56,Big Lots,1/21/17,,"'B00OFXLF0W',",,,"('B00OFXLF0W', 'Pantene Pro-V Expert Collection Dry Defy Intense Hydration Conditioner, 8.4 Ounce', 2, 13.95),"
"Pantene Pro-V Full and Strong Conditioner with Pump, 28 Ounce",BL03292017/4.86,B00VRAHHDK,"B00VRAHHDK,",6,23.98,4.86,29.16,Big Lots,3/29/17,,"'B00VRAHHDK',",,,"('B00VRAHHDK', 'Pantene Pro-V Full and Strong Conditioner with Pump, 28 Ounce', 6, 23.98),"
Pantene Pro-V Full and Strong Shampoo with Pump - 29.2 oz,BL04012017/4.27,B00VRAHGVI,"B00VRAHGVI,",1,19.99,4.27,4.27,Big Lots,4/1/17,,"'B00VRAHGVI',",,,"('B00VRAHGVI', 'Pantene Pro-V Full and Strong Shampoo with Pump - 29.2 oz', 1, 19.99),"
Pantene Pro-V Highlighting Expressions Daily Color Enhancing Conditioner - 13.5 oz - 2 pk,BL02272017/4.86,B00JJ1TUKC,"B00JJ1TUKC,",2,29.99,4.86,9.72,Big Lots,2/27/17,,"'B00JJ1TUKC',",,,"('B00JJ1TUKC', 'Pantene Pro-V Highlighting Expressions Daily Color Enhancing Conditioner - 13.5 oz - 2 pk', 2, 29.99),"
Pantene Pro-V Highlighting Expressions Daily Color Enhancing Shampoo - 13 oz - 2 pk,BL03142017/3.42,B00JGQ85AQ,"B00JGQ85AQ,",3,17,3.42,10.26,Big Lots,3/14/17,,"'B00JGQ85AQ',",,,"('B00JGQ85AQ', 'Pantene Pro-V Highlighting Expressions Daily Color Enhancing Shampoo - 13 oz - 2 pk', 3, 17),"
Pantene Pro-V Lightweight Conditioner - 12.6 oz,BL02082017/2.43,B00LV5BBTM,"B00LV5BBTM,",5,17.95,2.43,12.15,Big Lots,2/8/17,,"'B00LV5BBTM',",,,"('B00LV5BBTM', 'Pantene Pro-V Lightweight Conditioner - 12.6 oz', 5, 17.95),"
"Pantene Pro-V Weekly Rehab Creme, 1.9 oz, 2 Pack",WG01192017/2.71,B010E2CF2O,"B010E2CF2O,",1,17.99,2.71,2.71,Walgreens,1/19/17,,"'B010E2CF2O',",,,"('B010E2CF2O', 'Pantene Pro-V Weekly Rehab Creme, 1.9 oz, 2 Pack', 1, 17.99),"
"Pantene Pro-V Weekly Rehab Creme, 1.9 oz, 2 Pack",WG03092017/5.62,B010E2CF2O,"B010E2CF2O,",1,17.99,5.62,5.62,Walgreens,3/9/17,,"'B010E2CF2O',",,,"('B010E2CF2O', 'Pantene Pro-V Weekly Rehab Creme, 1.9 oz, 2 Pack', 1, 17.99),"
Paper Chase Self Adhesive Photo Album,FBA0610/2.13,B01DYJPH56,"B01DYJPH56,",2,15.99,2.13,4.26,NPS,6/10/16,,"'B01DYJPH56',",,,"('B01DYJPH56', 'Paper Chase Self Adhesive Photo Album', 2, 15.99),"
"Parodontax Clean Mint Daily Toothpaste, 3.4 oz. Per Tube (2 Pack)",FBA_2415,B06WD7XX6T,"B06WD7XX6T,",3,22.49,6.29,18.87,Walgreens,4/7/17,,"'B06WD7XX6T',",,,"('B06WD7XX6T', 'Parodontax Clean Mint Daily Toothpaste, 3.4 oz. Per Tube (2 Pack)', 3, 22.49),"
"Parodontax Whitening Toothpaste, 3.4 oz. Per Tube (2 Pack)",WG04072017/6.29,B06XMXJ84G,"B06XMXJ84G,",3,24.9,6.29,18.87,Walgreens,4/7/17,,"'B06XMXJ84G',",,,"('B06XMXJ84G', 'Parodontax Whitening Toothpaste, 3.4 oz. Per Tube (2 Pack)', 3, 24.9),"
"Pearl Izumi - Ride Women's Pro Softshell 180 Jacket, Black, X-Large",FBA08092016/30.63,B00KJGMT8G,"B00KJGMT8G,",1,90,30.63,30.63,Amazon,8/9/16,,"'B00KJGMT8G',",,,"('B00KJGMT8G', 'Pearl Izumi - Ride Women's Pro Softshell 180 Jacket, Black, X-Large', 1, 90),"
"Peeps Marshmallow Chicks, 1.125 Pound",TM04072016/6.4,B00N4K6N0E,"B00N4K6N0E,",1,35,6.4,6.4,Tuesday Morning,4/7/17,,"'B00N4K6N0E',",,,"('B00N4K6N0E', 'Peeps Marshmallow Chicks, 1.125 Pound', 1, 35),"
"Peeps Marshmallow Chicks, 1.125 Pound",TM03092017//8.54,B00N4K6N0E,"B00N4K6N0E,",2,35,8.54,17.08,Tuesday Morning,3/9/17,,"'B00N4K6N0E',",,,"('B00N4K6N0E', 'Peeps Marshmallow Chicks, 1.125 Pound', 2, 35),"
Physicians Formula Multi-colored Eye Brightener ~ Natural Eyelight (1613) ~ Hypoallergenic,RA03172017/4.5,B00VU8SOBI,"B00VU8SOBI,",1,16.99,4.5,4.5,Rite Aid,3/17/17,,"'B00VU8SOBI',",,,"('B00VU8SOBI', 'Physicians Formula Multi-colored Eye Brightener ~ Natural Eyelight (1613) ~ Hypoallergenic', 1, 16.99),"
Playskool Heroes Transformers Rescue Bots Blurr Figure,WG03312017/10.52,B00QCALLD2,"B00QCALLD2,",2,34.99,10.52,21.04,Walgreens,3/31/17,,"'B00QCALLD2',",,,"('B00QCALLD2', 'Playskool Heroes Transformers Rescue Bots Blurr Figure', 2, 34.99),"
Playskool Heroes Transformers Rescue Bots Rescan Brushfire Action Figure,WG03282017/12.35,B06XQK7KD3,"B06XQK7KD3,",1,28.99,12.35,12.35,Walgreens,3/28/17,,"'B06XQK7KD3',",,,"('B06XQK7KD3', 'Playskool Heroes Transformers Rescue Bots Rescan Brushfire Action Figure', 1, 28.99),"
Portmeirion Sophie Conran Blue Footed Bowl,TM03172017/12.81,B00UXKFL2O,"B00UXKFL2O,",2,44.97,12.81,25.62,Tuesday Morning,3/17/17,,"'B00UXKFL2O',",,,"('B00UXKFL2O', 'Portmeirion Sophie Conran Blue Footed Bowl', 2, 44.97),"
Power Ranger Samurai Mighty Morphin Rita Repulsa Action Figure [Toy],RA03162017/5.73,B005BTWQUM,"B005BTWQUM,",1,29.95,5.73,5.73,Rite Aid,3/16/17,,"'B005BTWQUM',",,,"('B005BTWQUM', 'Power Ranger Samurai Mighty Morphin Rita Repulsa Action Figure [Toy]', 1, 29.95),"
"Power Rangers Super Megaforce - 5"" SPD Omega Ranger Action Hero",WG03282017/9.39,B00JYFMO42,"B00JYFMO42,",1,32.99,9.39,9.39,Walgreens,3/28/17,,"'B00JYFMO42',",,,"('B00JYFMO42', 'Power Rangers Super Megaforce - 5"" SPD Omega Ranger Action Hero', 1, 32.99),"
Professional Spatula Set: Stainless Steel Pancake or Hamburger Turner for Grill or Griddle,FBA06/11/18.15,B0048HQSE8,"B0048HQSE8,",1,39.96,18.15,18.15,Cabela's,5/17/16,,"'B0048HQSE8',",,,"('B0048HQSE8', 'Professional Spatula Set: Stainless Steel Pancake or Hamburger Turner for Grill or Griddle', 1, 39.96),"
Ravensburger A Precious Moment Puzzle (200 Piece),TM03022017//4.27,B00SP6E69W,"B00SP6E69W,",1,16.83,4.27,4.27,Tuesday Morning,3/2/17,,"'B00SP6E69W',",,,"('B00SP6E69W', 'Ravensburger A Precious Moment Puzzle (200 Piece)', 1, 16.83),"
Ravensburger Beautiful Princess Puzzle (150-Piece),TM02252017/4.27,B00DQP8DEG,"B00DQP8DEG,",2,18.99,4.27,8.54,Tuesday Morning,2/25/17,,"'B00DQP8DEG',",,,"('B00DQP8DEG', 'Ravensburger Beautiful Princess Puzzle (150-Piece)', 2, 18.99),"
"Ravensburger Disney Princess 4 Large Shaped Puzzles (10, 12, 14, 16 Piece)",TM03272017/5.83,B00AQHOPDU,"B00AQHOPDU,",1,26.88,5.83,5.83,Tuesday Morning,3/27/17,,"'B00AQHOPDU',",,,"('B00AQHOPDU', 'Ravensburger Disney Princess 4 Large Shaped Puzzles (10, 12, 14, 16 Piece)', 1, 26.88),"
Ravensburger Doc McStuffins: All Better Now - Giant Floor Puzzle (24 Piece),TM03272017//4.99,B00UYW9B72,"B00UYW9B72,",1,24.95,4.99,4.99,Tuesday Morning,3/27/17,,"'B00UYW9B72',",,,"('B00UYW9B72', 'Ravensburger Doc McStuffins: All Better Now - Giant Floor Puzzle (24 Piece)', 1, 24.95),"
Ravensburger Fascinating Earth Jigsaw Puzzle (5000-Piece),TM02252017/25.64,B00CHJK0R0,"B00CHJK0R0,",1,69.99,25.64,25.64,Tuesday Morning,2/25/17,,"'B00CHJK0R0',",,,"('B00CHJK0R0', 'Ravensburger Fascinating Earth Jigsaw Puzzle (5000-Piece)', 1, 69.99),"
Ravensburger Pirate Map Puzzle (200 Piece),TM02252017//4.27,B00QM4VYN0,"B00QM4VYN0,",1,19.99,4.27,4.27,Tuesday Morning,2/25/17,,"'B00QM4VYN0',",,,"('B00QM4VYN0', 'Ravensburger Pirate Map Puzzle (200 Piece)', 1, 19.99),"
Ravensburger T-Rex Puzzle + App Games Puzzle (100 Piece),TM03022017/4.27,B00IVOPEB2,"B00IVOPEB2,",1,19.99,4.27,4.27,Tuesday Morning,3/2/17,,"'B00IVOPEB2',",,,"('B00IVOPEB2', 'Ravensburger T-Rex Puzzle + App Games Puzzle (100 Piece)', 1, 19.99),"
Ravensburger The Dragon Family Frame Tray Jigsaw Puzzle (35 Piece),TM01272017/2.72,B013NMYTN0,"B013NMYTN0,",6,18.99,2.72,16.32,Tuesday Morning,1/27/17,,"'B013NMYTN0',",,,"('B013NMYTN0', 'Ravensburger The Dragon Family Frame Tray Jigsaw Puzzle (35 Piece)', 6, 18.99),"
"Ravensburger World Map, 1665 - 3000 Piece Puzzle",TM02252017/12.81,B0000A12HJ,"B0000A12HJ,",1,58.99,12.81,12.81,Tuesday Morning,2/25/17,,"'B0000A12HJ',",,,"('B0000A12HJ', 'Ravensburger World Map, 1665 - 3000 Piece Puzzle', 1, 58.99),"
Ravioli 5 Piece Serving Bowl Set,TM03312017//16.66,B01DDUM9H0,"B01DDUM9H0,",1,49.99,16.66,16.66,Tuesday Morning,3/31/17,,"'B01DDUM9H0',",,,"('B01DDUM9H0', 'Ravioli 5 Piece Serving Bowl Set', 1, 49.99),"
Ravioli 7 Piece Coupe Serving Bowl Set,TM03312017/16.66,B01DDUM6PA,"B01DDUM6PA,",1,64.99,16.66,16.66,Tuesday Morning,3/31/17,,"'B01DDUM6PA',",,,"('B01DDUM6PA', 'Ravioli 7 Piece Coupe Serving Bowl Set', 1, 64.99),"
REACH ESSENTIAL 6 IN 1 BENEFITS ORAL RINSE 13.5oz (2 BOTTLES),BL03292017/1.94,B01AD37FE2,"B01AD37FE2,",1,17.99,1.94,1.94,Big Lots,3/29/17,,"'B01AD37FE2',",,,"('B01AD37FE2', 'REACH ESSENTIAL 6 IN 1 BENEFITS ORAL RINSE 13.5oz (2 BOTTLES)', 1, 17.99),"
Revlon Colorburst Lip Butter #063 Wild Watermelon (2 Tubes),BL03142017/3.11,B00QLPK0W6,"B00QLPK0W6,",1,13.99,3.11,3.11,Big Lots,3/14/17,,"'B00QLPK0W6',",,,"('B00QLPK0W6', 'Revlon Colorburst Lip Butter #063 Wild Watermelon (2 Tubes)', 1, 13.99),"
Revlon Colorburst Lip Butter Raspberry Pie #010,BL03142017/1.56,B015LK2XBM,"B015LK2XBM,",1,15.99,1.56,1.56,Big Lots,3/14/17,,"'B015LK2XBM',",,,"('B015LK2XBM', 'Revlon Colorburst Lip Butter Raspberry Pie #010', 1, 15.99),"
"Revlon ColorBurst Lip Butter, Cotton Candy 0.09 oz (Pack of 2)",BL04012017/3.2,B013CLLNZ4,"B013CLLNZ4,",4,16.99,3.2,12.8,Big Lots,4/1/17,,"'B013CLLNZ4',",,,"('B013CLLNZ4', 'Revlon ColorBurst Lip Butter, Cotton Candy 0.09 oz (Pack of 2)', 4, 16.99),"
"Revlon Colorburst Lip Butter, Cotton Candy, 0.09 Ounce (Pack of 2)",BL02272017/3.23,B013CN8P62,"B013CN8P62,",6,15.99,3.23,19.38,Big Lots,2/27/17,,"'B013CN8P62',",,,"('B013CN8P62', 'Revlon Colorburst Lip Butter, Cotton Candy, 0.09 Ounce (Pack of 2)', 6, 15.99),"
"REVLON Colorburst Lip Butter, Gumdrop, 0.09 Ounce",BL02232017/1.77,B006GQSS7O,"B006GQSS7O,",3,10.99,1.77,5.31,Big Lots,2/23/17,,"'B006GQSS7O',",,,"('B006GQSS7O', 'REVLON Colorburst Lip Butter, Gumdrop, 0.09 Ounce', 3, 10.99),"
"Revlon ColorBurst Lip Butter, Lollipop 0.09 oz (Pack of 2)",BL04012017/3.42,B00VR3ZLE4,"B00VR3ZLE4,",2,17.99,3.42,6.84,Big Lots,4/1/17,,"'B00VR3ZLE4',",,,"('B00VR3ZLE4', 'Revlon ColorBurst Lip Butter, Lollipop 0.09 oz (Pack of 2)', 2, 17.99),"
"REVLON Colorburst Lip Butter, Lollipop, 0.09 Ounce",RA01122017/1.85,B006GQH096,"B006GQH096,",1,10.15,1.85,1.85,Rite Aid,1/12/17,,"'B006GQH096',",,,"('B006GQH096', 'REVLON Colorburst Lip Butter, Lollipop, 0.09 Ounce', 1, 10.15),"
"Revlon ColorBurst Lip Butter, Pink Truffle 0.09 oz (2.55 g)",BL03032017/1.54,B0180VDNLI,"B0180VDNLI,",10,12.99,1.54,15.4,Big Lots,3/3/17,,"'B0180VDNLI',",,,"('B0180VDNLI', 'Revlon ColorBurst Lip Butter, Pink Truffle 0.09 oz (2.55 g)', 10, 12.99),"
"REVLON Colorburst Lip Butter, Red Velvet, 0.09 Ounce",BL02232017--1.77,B006GQFHYG,"B006GQFHYG,",3,10.95,1.77,5.31,Big Lots,2/23/17,,"'B006GQFHYG',",,,"('B006GQFHYG', 'REVLON Colorburst Lip Butter, Red Velvet, 0.09 Ounce', 3, 10.95),"
"REVLON Colorburst Lip Butter, Sugar Plum, 0.09 Ounce",BL02232017//1.77,B006GQB6BE,"B006GQB6BE,",4,10.49,1.77,7.08,Big Lots,2/23/17,,"'B006GQB6BE',",,,"('B006GQB6BE', 'REVLON Colorburst Lip Butter, Sugar Plum, 0.09 Ounce', 4, 10.49),"
"REVLON Colorburst Lip Butter, Tutti Frutti, 0.09 Ounce",BL03032017//1.54,B006OZF74O,"B006OZF74O,",1,13.99,1.54,1.54,Big Lots,3/3/17,,"'B006OZF74O',",,,"('B006OZF74O', 'REVLON Colorburst Lip Butter, Tutti Frutti, 0.09 Ounce', 1, 13.99),"
"Revlon ColorStay Ultimate Suede Lipstick, Ready to Wear/003, 0.09 Ounce",BL03032017/3.08,B00MDH1WTQ,"B00MDH1WTQ,",1,11.49,3.08,3.08,Big Lots,3/3/17,,"'B00MDH1WTQ',",,,"('B00MDH1WTQ', 'Revlon ColorStay Ultimate Suede Lipstick, Ready to Wear/003, 0.09 Ounce', 1, 11.49),"
"Revlon Cream Blush, 150 Charmed, 0.44 Ounce",BL03032017--1.54,B00IIKJFT6,"B00IIKJFT6,",6,12.99,1.54,9.24,Big Lots,3/3/17,,"'B00IIKJFT6',",,,"('B00IIKJFT6', 'Revlon Cream Blush, 150 Charmed, 0.44 Ounce', 6, 12.99),"
"Revlon Powder Blush, 004 Wine Not 0.17 oz - Pack of 2",BL03032017/3.85,B00JP5K4BG,"B00JP5K4BG,",3,19.99,3.85,11.55,Big Lots,3/3/17,,"'B00JP5K4BG',",,,"('B00JP5K4BG', 'Revlon Powder Blush, 004 Wine Not 0.17 oz - Pack of 2', 3, 19.99),"
"Revlon Super Lustrous Lipstick, Peach Me, 0.15 Ounce",RA01262017/2.12,B001LFER98,"B001LFER98,",1,10,2.12,2.12,Rite Aid,1/26/17,,"'B001LFER98',",,,"('B001LFER98', 'Revlon Super Lustrous Lipstick, Peach Me, 0.15 Ounce', 1, 10),"
Right Guard Hair & Body Wash - Xtreme Cooling With Menthol - Net Wt. 16 FL OZ (473 mL) Each - Pack of 2,NPS10222016_6.39,B00NH81BWI,"B00NH81BWI,",5,24.99,6.39,31.95,NPS,10/22/16,,"'B00NH81BWI',",,,"('B00NH81BWI', 'Right Guard Hair & Body Wash - Xtreme Cooling With Menthol - Net Wt. 16 FL OZ (473 mL) Each - Pack of 2', 5, 24.99),"
Rockport Men's RocSports Lite ActivFlex Slip On Dark Brown 11.5 M (D),FBA06042016__44,B00HK7S58K,"B00HK7S58K,",1,74.95,43.97,43.97,Amazon,5/30/16,,"'B00HK7S58K',",,,"('B00HK7S58K', 'Rockport Men's RocSports Lite ActivFlex Slip On Dark Brown 11.5 M (D)', 1, 74.95),"
Roll Out Garden Bed of English Lavender Seeds,BL04012017/4.2,B00VSZ535I,"B00VSZ535I,",8,17.25,4.2,33.6,Big Lots,4/1/17,,"'B00VSZ535I',",,,"('B00VSZ535I', 'Roll Out Garden Bed of English Lavender Seeds', 8, 17.25),"
"Rompe Pecho CF Cough & Flu Syrup With Honey, 6 oz",WG11042016/5.52,B001IAI51W,"B001IAI51W,",2,16.99,5.52,11.04,Walgreens,11/4/16,,"'B001IAI51W',",,,"('B001IAI51W', 'Rompe Pecho CF Cough & Flu Syrup With Honey, 6 oz', 2, 16.99),"
"Rosanna Cocktails Appetizer Plates, Set of 4",TM04062017/8.88,B008FJYOW8,"B008FJYOW8,",1,39.99,8.88,8.88,Tuesday Morning,4/6/17,,"'B008FJYOW8',",,,"('B008FJYOW8', 'Rosanna Cocktails Appetizer Plates, Set of 4', 1, 39.99),"
"Rosanna Portico Trinket Dish, Small, Set of 4",TM04062017/6.83,B00E1HJAA4,"B00E1HJAA4,",1,39.99,6.83,6.83,Tuesday Morning,4/6/17,,"'B00E1HJAA4',",,,"('B00E1HJAA4', 'Rosanna Portico Trinket Dish, Small, Set of 4', 1, 39.99),"
"Royal Chocolates Belgian Chocolate Thins Dark, 4.4-Ounce (Pack of 6)",TM02102017//18.64,B0045TRY9M,"B0045TRY9M,",1,44.99,18.64,18.64,Tuesday Morning,2/10/17,,"'B0045TRY9M',",,,"('B0045TRY9M', 'Royal Chocolates Belgian Chocolate Thins Dark, 4.4-Ounce (Pack of 6)', 1, 44.99),"
"Royal Chocolates Belgian Chocolate Thins Milk, 4.4-Ounce (Pack of 6)",TM02102017/18.59,B0045H4TZ6,"B0045H4TZ6,",1,44.95,18.59,18.59,Tuesday Morning,2/10/17,,"'B0045H4TZ6',",,,"('B0045H4TZ6', 'Royal Chocolates Belgian Chocolate Thins Milk, 4.4-Ounce (Pack of 6)', 1, 44.95),"
S390G Smartphone - Wi-Fi - 3G - Bar - Black,RA11112016/12.49,B0091BL260,"B0091BL260,",1,22.5,12.49,12.49,Rite Aid,11/11/16,,"'B0091BL260',",,,"('B0091BL260', 'S390G Smartphone - Wi-Fi - 3G - Bar - Black', 1, 22.5),"
Samsung T101G Prepaid Phone (Tracfone),FBA08162016/4.62,B002I9Z4WK,"B002I9Z4WK,",2,34.99,4.62,9.24,Rite Aid,8/16/16,,"'B002I9Z4WK',",,,"('B002I9Z4WK', 'Samsung T101G Prepaid Phone (Tracfone)', 2, 34.99),"
"Sebago Men's Wicklow Loafer,Black,7 D US",FBA08042106/38.99,B00ENYSB8W,"B00ENYSB8W,",1,89,38.99,38.99,Amazon,8/4/16,,"'B00ENYSB8W',",,,"('B00ENYSB8W', 'Sebago Men's Wicklow Loafer,Black,7 D US', 1, 89),"
Sharper Image Digital Tranquility Sound Soother,TM02102017/18.16,B00PGHUB6A,"B00PGHUB6A,",10,48.99,18.16,181.6,Tuesday Morning,2/10/17,,"'B00PGHUB6A',",,,"('B00PGHUB6A', 'Sharper Image Digital Tranquility Sound Soother', 10, 48.99),"
Sharper Image Heated Travel Mug Set,TM01052017/7.08,B00S1NFBPM,"B00S1NFBPM,",4,21.99,7.08,28.32,Tuesday Morning,1/5/17,,"'B00S1NFBPM',",,,"('B00S1NFBPM', 'Sharper Image Heated Travel Mug Set', 4, 21.99),"
Sharper Image Motion-Activated Candy Dispenser (Colors May Vary),WG03312017/11.4,B00GOW6ZMU,"B00GOW6ZMU,",1,39.99,11.4,11.4,Walgreens,3/31/17,,"'B00GOW6ZMU',",,,"('B00GOW6ZMU', 'Sharper Image Motion-Activated Candy Dispenser (Colors May Vary)', 1, 39.99),"
Sharper Image Motion-Activated Candy Dispenser (RED),WG03282017/14.25,B01B2AWDT2,"B01B2AWDT2,",2,44.99,14.25,28.5,Walgreens,3/28/17,,"'B01B2AWDT2',",,,"('B01B2AWDT2', 'Sharper Image Motion-Activated Candy Dispenser (RED)', 2, 44.99),"
"SiliconeZone 10.6"" 6 Cup Non-Stick Silicone Heart Baking Pan, Dark Pink",TM03022017//5.12,B009YE1PXY,"B009YE1PXY,",1,29.99,5.12,5.12,Tuesday Morning,3/2/17,,"'B009YE1PXY',",,,"('B009YE1PXY', 'SiliconeZone 10.6"" 6 Cup Non-Stick Silicone Heart Baking Pan, Dark Pink', 1, 29.99),"
"Skinny Syrups - Classic Syrup Trio Contains 3 Bottles Vanilla, Mocha , Salted Caramel",TM02092017/7.34,B016WT21YU,"B016WT21YU,",1,29,7.34,7.34,Tuesday Morning,2/9/17,,"'B016WT21YU',",,,"('B016WT21YU', 'Skinny Syrups - Classic Syrup Trio Contains 3 Bottles Vanilla, Mocha , Salted Caramel', 1, 29),"
Slimquick Slimquick Razor X Strong 60 Cap,WG02102017/6.96,B0077IHYAC,"B0077IHYAC,",1,31.99,6.96,6.96,Walgreens,2/10/17,,"'B0077IHYAC',",,,"('B0077IHYAC', 'Slimquick Slimquick Razor X Strong 60 Cap', 1, 31.99),"
Smith & Nephew Secura Extra Protective Cream (EPC) Tube 3.25oz,FBA_41,B000RDN1NI,"B000RDN1NI,",1,14.99,1.07,1.07,NPS,9/6/16,,"'B000RDN1NI',",,,"('B000RDN1NI', 'Smith & Nephew Secura Extra Protective Cream (EPC) Tube 3.25oz', 1, 14.99),"
"Social Media in Healthcare: Connect, Communicate, Collaborate, 2nd Edition",FBA07012016_5.24,1567935761,"1567935761,",1,13.5,5.24,5.24,Amazon,7/1/16,,"'1567935761',",,,"('1567935761', 'Social Media in Healthcare: Connect, Communicate, Collaborate, 2nd Edition', 1, 13.5),"
Sofia the First Ultimate Dress-Up Trunk,TM03272017/7.49,B00FQO3DIG,"B00FQO3DIG,",1,37,7.49,7.49,Tuesday Morning,3/27/17,,"'B00FQO3DIG',",,,"('B00FQO3DIG', 'Sofia the First Ultimate Dress-Up Trunk', 1, 37),"
Special Forces Five Piece Military Team by Polyfect Toys,TM01052017/3.62,B00OFI8WSA,"B00OFI8WSA,",5,14.99,3.62,18.1,Tuesday Morning,1/5/17,,"'B00OFI8WSA',",,,"('B00OFI8WSA', 'Special Forces Five Piece Military Team by Polyfect Toys', 5, 14.99),"
"Sperry Bluefish Boat Shoe (Little Kid/Big Kid),Silver Cloud,2 W US Little Kid",FBA07032016/21.27,B00Q6BYDVE,"B00Q6BYDVE,",1,55.1,21.27,21.27,Amazon,7/3/16,,"'B00Q6BYDVE',",,,"('B00Q6BYDVE', 'Sperry Bluefish Boat Shoe (Little Kid/Big Kid),Silver Cloud,2 W US Little Kid', 1, 55.1),"
Steven Raichlen Best of Barbecue Cast Iron Pizza Pan / 14 Diameter - SR8165,TM02102017/17.75,B00MB6DY6I,"B00MB6DY6I,",1,52.99,17.75,17.75,Tuesday Morning,2/10/17,,"'B00MB6DY6I',",,,"('B00MB6DY6I', 'Steven Raichlen Best of Barbecue Cast Iron Pizza Pan / 14 Diameter - SR8165', 1, 52.99),"
"Stone Mage Wars, Book 1: Journey To the Fringe",FBA03052016__5,1609088336,"1609088336,",1,9.99,2.13,2.13,Seagull Book,3/4/16,,"'1609088336',",,,"('1609088336', 'Stone Mage Wars, Book 1: Journey To the Fringe', 1, 9.99),"
Student Activities Manual for Identidades: Exploraciones e interconexiones,FBA07132016/6.31,205036163,"205036163,",1,17,6.31,6.31,Amazon,7/13/16,,"'205036163',",,,"('205036163', 'Student Activities Manual for Identidades: Exploraciones e interconexiones', 1, 17),"
Student Solutions Manual for College Physics,FBA06132016/9.79,321747690,"321747690,",1,19.5,9.79,9.79,Amazon,6/13/16,,"'321747690',",,,"('321747690', 'Student Solutions Manual for College Physics', 1, 19.5),"
Students' Guide to Article 9 and Related Statutes (Student Guides),FBA07132016/9.45,031427670X,"031427670X,",1,29.99,9.45,9.45,Amazon,7/13/16,,"'031427670X',",,,"('031427670X', 'Students' Guide to Article 9 and Related Statutes (Student Guides)', 1, 29.99),"
Styli-Style Line & Seal 24 Twist for Eyes 177 Diamond,FBA08202016/1.73,B001U1O0DG,"B001U1O0DG,",3,8.49,1.73,5.19,Rite Aid,8/20/16,,"'B001U1O0DG',",,,"('B001U1O0DG', 'Styli-Style Line & Seal 24 Twist for Eyes 177 Diamond', 3, 8.49),"
"Suave Professionals Conditioner, Natural Infusion Seaweed & Lotus Blossom 28 oz",BL03262017/4.86,B00GTC0346,"B00GTC0346,",1,19.99,4.86,4.86,Big Lots,3/26/18,,"'B00GTC0346',",,,"('B00GTC0346', 'Suave Professionals Conditioner, Natural Infusion Seaweed & Lotus Blossom 28 oz', 1, 19.99),"
Suave Professionals Natural Infusion Ginger Shampoo 28 oz,BL02032017/3.89,B00GTBZXPG,"B00GTBZXPG,",1,14.51,3.89,3.89,Big Lots,2/3/17,,"'B00GTBZXPG',",,,"('B00GTBZXPG', 'Suave Professionals Natural Infusion Ginger Shampoo 28 oz', 1, 14.51),"
"Suave Professionals Spray, Heat Protection, 6.7 Ounce (Pack of 3)",BL04012017/4.81,B00JOLS5H6,"B00JOLS5H6,",2,21.99,4.81,9.62,Big Lots,4/1/17,,"'B00JOLS5H6',",,,"('B00JOLS5H6', 'Suave Professionals Spray, Heat Protection, 6.7 Ounce (Pack of 3)', 2, 21.99),"
Sween 24 Once A Day Moisturizing Body Cream - 5 oz,NPS03092017/4.26,B00HZKLDSG,"B00HZKLDSG,",2,13.6,4.26,8.52,NPS,3/9/17,,"'B00HZKLDSG',",,,"('B00HZKLDSG', 'Sween 24 Once A Day Moisturizing Body Cream - 5 oz', 2, 13.6),"
"Taipei 101 Tower 3D Puzzle, 216-Piece",TM03272017/8.33,B006ZWDUH2,"B006ZWDUH2,",2,39.59,8.33,16.66,Tuesday Morning,3/27/17,,"'B006ZWDUH2',",,,"('B006ZWDUH2', 'Taipei 101 Tower 3D Puzzle, 216-Piece', 2, 39.59),"
"Taking Sides: Clashing Views on Global Issues, Expanded",FBA07132016/15.98,78050448,"78050448,",1,23,15.98,15.98,Amazon,7/13/16,,"'78050448',",,,"('78050448', 'Taking Sides: Clashing Views on Global Issues, Expanded', 1, 23),"
"Teenage Mutant Ninja Turtles 11"" Battle Shell Shredder #2 Figure",BL04012017/18.17,B00M4O0IH0,"B00M4O0IH0,",1,53.99,18.17,18.17,Target,4/1/17,,"'B00M4O0IH0',",,,"('B00M4O0IH0', 'Teenage Mutant Ninja Turtles 11"" Battle Shell Shredder #2 Figure', 1, 53.99),"
Teenage Mutant Ninja Turtles April O'Neil,BL04012017_8.55,B008DBZC8S,"B008DBZC8S,",1,23.98,8.55,8.55,Big Lots,4/1/17,,"'B008DBZC8S',",,,"('B008DBZC8S', 'Teenage Mutant Ninja Turtles April O'Neil', 1, 23.98),"
Teenage Mutant Ninja Turtles Mondo Gecko Figure,WG03312017/3,B00WC0DTHW,"B00WC0DTHW,",1,15.7,3,3,Walgreens,3/31/17,,"'B00WC0DTHW',",,,"('B00WC0DTHW', 'Teenage Mutant Ninja Turtles Mondo Gecko Figure', 1, 15.7),"
Teenage Mutant Ninja Turtles Movie April O'Neil Basic Figure,GM04052017//6.68,B00ITKVKGG,"B00ITKVKGG,",1,26.87,6.68,6.68,Gordmans,4/5/17,,"'B00ITKVKGG',",,,"('B00ITKVKGG', 'Teenage Mutant Ninja Turtles Movie April O'Neil Basic Figure', 1, 26.87),"
Teenage Mutant Ninja Turtles Newtralizer Action Figure,BL04012017///8.55,B00DV61KYU,"B00DV61KYU,",1,34.34,8.55,8.55,Big Lots,4/1/17,,"'B00DV61KYU',",,,"('B00DV61KYU', 'Teenage Mutant Ninja Turtles Newtralizer Action Figure', 1, 34.34),"
Teenage Mutant Ninja Turtles Rat King Action Figure,GM04052017/6.68,B00CUB6OPW,"B00CUB6OPW,",1,24.99,6.68,6.68,Gordmans,4/5/17,,"'B00CUB6OPW',",,,"('B00CUB6OPW', 'Teenage Mutant Ninja Turtles Rat King Action Figure', 1, 24.99),"
Teenage Mutant Ninja Turtles Shredder Deluxe Mask,GM04052017-7.42,B00E4MPQW2,"B00E4MPQW2,",1,30.95,7.42,7.42,Gordmans,4/5/17,,"'B00E4MPQW2',",,,"('B00E4MPQW2', 'Teenage Mutant Ninja Turtles Shredder Deluxe Mask', 1, 30.95),"
Teenage Mutant Ninja Turtles Slash Figure,BL04012017/8.55,B00KZNGJI4,"B00KZNGJI4,",1,32.99,8.55,8.55,Big Lots,4/1/17,,"'B00KZNGJI4',",,,"('B00KZNGJI4', 'Teenage Mutant Ninja Turtles Slash Figure', 1, 32.99),"
Teenage Mutant Ninja Turtles Splinter,RA03292018/9.24,B008DBZC8I,"B008DBZC8I,",1,34.45,9.24,9.24,Rite Aid,3/29/17,,"'B008DBZC8I',",,,"('B008DBZC8I', 'Teenage Mutant Ninja Turtles Splinter', 1, 34.45),"
"The Guardian, Book 2 : To Run with the Swift By Gerald N. Lund (2013, Hardcover)",FBA03052016__29,1609077962,"1609077962,",1,13.07,4.26,4.26,Seagull Book,3/7/16,,"'1609077962',",,,"('1609077962', 'The Guardian, Book 2 : To Run with the Swift By Gerald N. Lund (2013, Hardcover)', 1, 13.07),"
"The Learning Journey Match It! Listen & Play Bingo, Transportation",TM03272017//5.83,B00TM0HTYO,"B00TM0HTYO,",1,24.99,5.83,5.83,Tuesday Morning,3/27/17,,"'B00TM0HTYO',",,,"('B00TM0HTYO', 'The Learning Journey Match It! Listen & Play Bingo, Transportation', 1, 24.99),"
The Oregon Trail Card Game by Pressman Toy,TG11032016/5.41,B01JF4CHWK,"B01JF4CHWK,",11,25.99,5.41,59.51,Target,11/3/16,,"'B01JF4CHWK',",,,"('B01JF4CHWK', 'The Oregon Trail Card Game by Pressman Toy', 11, 25.99),"
The Savior's Final Week: A 3-in-1 Paperback Omnibus,FBA03012016/6.4,1609078500,"1609078500,",2,22.99,6.4,12.8,Seagull Book,3/1/16,,"'1609078500',",,,"('1609078500', 'The Savior's Final Week: A 3-in-1 Paperback Omnibus', 2, 22.99),"
The Sharper Image Stainless Steel Multifunction Gravy Pitcher,TM01262017/11.8,B00HOPJ4HE,"B00HOPJ4HE,",2,28.95,11.8,23.6,Tuesday Morning,1/26/17,,"'B00HOPJ4HE',",,,"('B00HOPJ4HE', 'The Sharper Image Stainless Steel Multifunction Gravy Pitcher', 2, 28.95),"
Thomas & Friends: 4 Friends 4 Shaped Puzzles,TM03272017/4.99,B005GOPU2S,"B005GOPU2S,",1,34.99,4.99,4.99,Tuesday Morning,3/27/17,,"'B005GOPU2S',",,,"('B005GOPU2S', 'Thomas & Friends: 4 Friends 4 Shaped Puzzles', 1, 34.99),"
"Toni&Guy Cleanse Shampoo for Dry Hair, 8.5 Fluid Ounce (Pack of 2)",BL02082017/5.83,B00M9HEYP4,"B00M9HEYP4,",4,28,5.83,23.32,Big Lots,2/8/17,,"'B00M9HEYP4',",,,"('B00M9HEYP4', 'Toni&Guy Cleanse Shampoo for Dry Hair, 8.5 Fluid Ounce (Pack of 2)', 4, 28),"
Toystate Road Rippers Light and Sound Raminator 4X4 Monster Truck Vehicle (Styles May Vary),GM04052017/5.93,B00KJH6I00,"B00KJH6I00,",1,29.99,5.93,5.93,Gordmans,4/5/17,,"'B00KJH6I00',",,,"('B00KJH6I00', 'Toystate Road Rippers Light and Sound Raminator 4X4 Monster Truck Vehicle (Styles May Vary)', 1, 29.99),"
Transformers Generations Titans Return Decepticon Krok and Gatorface,WG04062017/16.72,B01LY11Y26,"B01LY11Y26,",1,39.25,16.72,16.72,Walgreens,4/6/17,,"'B01LY11Y26',",,,"('B01LY11Y26', 'Transformers Generations Titans Return Decepticon Krok and Gatorface', 1, 39.25),"
